{
  "$schema": "https://json-schema.org/draft/2020-12/schema",
  "type": "object",
  "required": ["id", "type", "fields", "updated_at"],
  "additionalProperties": false,
  "properties": {
    "id": {"type": "string", "pattern": "^[A-Za-z0-9_.-]+$"},
    "type": {"type": "string", "pattern": "^[A-Za-z0-9_.-]+$"},
    "updated_at": {"type": "string", "format": "date-time"},
    "fields": {
      "type": "object",
      "minProperties": 1,
      "additionalProperties": {
        "type": "object",
        "required": ["value", "provenance"],
        "additionalProperties": false,
        "properties": {
          "value": {},
          "provenance": {
            "type": "array",
            "minItems": 1,
            "items": {
              "type": "object",
              "required": ["proposal_id", "source_id", "locator", "applied_at"],
              "additionalProperties": false,
              "properties": {
                "proposal_id": {"type": "string", "minLength": 1},
                "source_id": {"type": "string", "minLength": 1},
                "locator": {"type": "string", "minLength": 1},
                "applied_at": {"type": "string", "format": "date-time"}
              }
            }
          }
        }
      }
    }
  }
}
