{
  "fields": {
    "details": {
      "provenance": [
        {
          "applied_at": "2026-07-19T17:07:30+00:00",
          "locator": "reponses-delia-questionnaire-2026-07-19.txt#Q52-Q54",
          "proposal_id": "proposal-delia-q52-creche",
          "source_id": "src-6d29e5e55ff715de"
        }
      ],
      "value": {
        "capacity_cribs": 24,
        "end_year": 2018,
        "engagement_type": "bénévole",
        "organization": "crèche associative Cadet-Roussel",
        "responsibilities": [
          "gestion",
          "entretiens de fin d’année"
        ],
        "staff_count": 11,
        "start_year": 2015,
        "title": "présidente"
      }
    },
    "industry_sector_ids": {
      "provenance": [
        {
          "applied_at": "2026-07-21T16:12:17+00:00",
          "locator": "validation-normalisation-secteurs-experiences-2026-07-21.txt#P03",
          "proposal_id": "proposal-experience-sectors-cadet-roussel-president-2026-07-21",
          "source_id": "src-7cfae887f36b6c4d"
        }
      ],
      "value": [
        "petite-enfance",
        "economie-sociale-et-associative"
      ]
    },
    "mission": {
      "provenance": [
        {
          "applied_at": "2026-07-19T18:23:47+00:00",
          "locator": "validation-missions-experiences-2026-07-19.txt#P09",
          "proposal_id": "proposal-delia-mission-cadet-roussel",
          "source_id": "src-db65a2ba5207c61f"
        }
      ],
      "value": "Assurer la gouvernance et la gestion d’une crèche associative de 24 berceaux et 11 salariés."
    }
  },
  "id": "cadet-roussel-president",
  "type": "experience",
  "updated_at": "2026-07-21T16:12:17+00:00"
}
